,Name,Risk,Category,Rating,1 Year Return,3 Years Return,5 Years Return
0,Quant Small Cap Fund Direct Plan Growth,Very High Risk,Equity,5,12.91%,54.68%,24.09%
1,Bank of India Small Cap Fund Direct Growth,Very High Risk,Equity,4,7.96%,41.78%,NA%
2,ICICI Prudential Commodities Fund Direct Growth,High Risk,Equity,,21.60%,41.64%,NA%
3,Canara Robeco Small Cap Fund Direct Growth,Very High Risk,Equity,5,14.88%,41.38%,NA%
4,Quant Tax Plan Direct Growth,Very High Risk,Equity,5,17.25%,41.27%,24.48%
5,Quant Infrastructure Fund Direct Growth,Very High Risk,Equity,5,17.74%,41.00%,23.06%
6,PGIM India Midcap Opportunities Fund Direct Growth,Very High Risk,Equity,5,8.92%,39.43%,20.25%
7,Quant Flexi Cap Fund Direct Growth,Very High Risk,Equity,,14.30%,38.94%,20.01%
8,Quant Mid Cap Fund Direct Growth,Very High Risk,Equity,5,20.84%,38.46%,22.32%
9,ICICI Prudential Technology Direct Plan Growth,Very High Risk,Equity,,-11.54%,38.18%,27.52%
10,Nippon India Small Cap Fund Direct Growth,Very High Risk,Equity,4,16.57%,37.05%,17.58%
11,Quant Active Fund Direct Growth,Very High Risk,Equity,,14.53%,36.89%,23.34%
12,Edelweiss Small Cap Fund Direct Growth,Very High Risk,Equity,4,10.05%,36.04%,NA%
13,Aditya Birla Sun Life Digital India Fund Direct Growth,Very High Risk,Equity,,-9.68%,34.61%,26.83%
14,Tata Digital India Fund Direct Growth,Very High Risk,Equity,,-10.94%,34.60%,28.21%
15,Quant Small Cap Fund Direct Plan Growth,Very High Risk,Equity,5,12.91%,54.68%,24.09%
16,Bank of India Small Cap Fund Direct Growth,Very High Risk,Equity,4,7.96%,41.78%,NA%
17,ICICI Prudential Commodities Fund Direct Growth,High Risk,Equity,,21.60%,41.64%,NA%
18,Canara Robeco Small Cap Fund Direct Growth,Very High Risk,Equity,5,14.88%,41.38%,NA%
19,Quant Tax Plan Direct Growth,Very High Risk,Equity,5,17.25%,41.27%,24.48%
20,Quant Infrastructure Fund Direct Growth,Very High Risk,Equity,5,17.74%,41.00%,23.06%
21,PGIM India Midcap Opportunities Fund Direct Growth,Very High Risk,Equity,5,8.92%,39.43%,20.25%
22,Quant Flexi Cap Fund Direct Growth,Very High Risk,Equity,,14.30%,38.94%,20.01%
23,Quant Mid Cap Fund Direct Growth,Very High Risk,Equity,5,20.84%,38.46%,22.32%
24,ICICI Prudential Technology Direct Plan Growth,Very High Risk,Equity,,-11.54%,38.18%,27.52%
25,Nippon India Small Cap Fund Direct Growth,Very High Risk,Equity,4,16.57%,37.05%,17.58%
26,Quant Active Fund Direct Growth,Very High Risk,Equity,,14.53%,36.89%,23.34%
27,Edelweiss Small Cap Fund Direct Growth,Very High Risk,Equity,4,10.05%,36.04%,NA%
28,Aditya Birla Sun Life Digital India Fund Direct Growth,Very High Risk,Equity,,-9.68%,34.61%,26.83%
29,Tata Digital India Fund Direct Growth,Very High Risk,Equity,,-10.94%,34.60%,28.21%
30,Kotak Small Cap Fund Direct Growth,Very High Risk,Equity,4,2.13%,34.36%,17.67%
31,Tata Small Cap Fund Direct Growth,Very High Risk,Equity,3,14.51%,34.25%,NA%
32,SBI Technology Opportunities Fund Direct Growth,Very High Risk,Equity,,-4.61%,32.88%,26.75%
33,Quant Absolute Fund Direct Growth,Very High Risk,Hybrid,5,17.74%,32.06%,20.56%
34,DSP Small Cap Direct Plan Growth,Very High Risk,Equity,3,8.29%,32.03%,12.79%
35,SBI Contra Direct Plan Growth,Very High Risk,Equity,5,18.21%,31.83%,15.65%
36,ICICI Prudential Smallcap Fund Direct Plan Growth,Very High Risk,Equity,4,10.64%,31.81%,15.36%
37,Quant Multi Asset Fund Direct Growth,Very High Risk,Hybrid,5,18.01%,31.58%,21.50%
38,Union Small Cap Fund Direct Growth,Very High Risk,Equity,3,7.16%,31.24%,14.59%
39,SBI Small Cap Fund Direct Growth,Very High Risk,Equity,4,13.46%,31.03%,16.25%
40,Invesco India Smallcap Fund Direct Growth,Very High Risk,Equity,3,6.36%,30.32%,NA%
41,HSBC Small Cap Fund Direct Growth,Very High Risk,Equity,3,11.52%,30.24%,13.65%
42,IDBI Small Cap Fund Direct Growth,Very High Risk,Equity,3,11.62%,30.15%,14.17%
43,DSP Healthcare Fund Direct Growth,Very High Risk,Equity,,1.61%,30.10%,NA%
44,Axis Small Cap Fund Direct Growth,Very High Risk,Equity,5,9.97%,29.87%,20.07%
45,Sundaram Small Cap Fund Direct Growth,Very High Risk,Equity,2,5.21%,29.52%,9.86%
46,HSBC Small Cap Fund Direct Growth,Very High Risk,Equity,3,6.98%,29.44%,12.93%
47,SBI Magnum Mid Cap Direct Plan Growth,Very High Risk,Equity,4,8.67%,29.36%,13.67%
48,HDFC Small Cap Fund Direct Growth,Very High Risk,Equity,3,12.02%,29.36%,14.41%
49,Bank of India Manufacturing & Infrastructure Direct Growth,Very High Risk,Equity,4,11.29%,29.28%,13.31%
50,Mirae Asset Healthcare Fund Direct Growth,Very High Risk,Equity,,-3.21%,28.73%,NA%
51,Edelweiss Mid Cap Direct Plan Growth,Very High Risk,Equity,4,10.37%,28.51%,15.45%
52,Mirae Asset Midcap Fund Direct Growth,Moderately High Risk,Equity,4,9.09%,28.06%,NA%
53,Tata Resources & Energy Fund Direct Growth,Very High Risk,Equity,,7.54%,27.93%,15.81%
54,Quant Large and Mid Cap Fund Direct Growth,Very High Risk,Equity,5,15.98%,27.60%,15.90%
55,ICICI Prudential India Opportunities Fund Direct Growth,Very High Risk,Equity,,23.28%,27.53%,NA%
56,Motilal Oswal Midcap Fund Direct Growth,Very High Risk,Equity,4,19.87%,27.50%,16.21%
57,IDFC Sterling Value Fund Direct Plan Growth,Very High Risk,Equity,3,12.68%,27.49%,12.58%
58,ICICI Prudential Infrastructure Direct Growth,Very High Risk,Equity,4,29.44%,27.22%,13.94%
59,Motilal Oswal Nifty Smallcap 250 Index Fund Direct Growth,Moderately High Risk,Other,2,3.30%,26.87%,NA%
60,UTI Mid Cap Fund Direct Growth,Very High Risk,Equity,3,5.54%,26.81%,12.84%
61,Nippon India Growth Fund Direct Growth,Very High Risk,Equity,4,12.12%,26.79%,15.39%
62,Kotak Emerging Equity Fund Direct Growth,Very High Risk,Equity,4,10.20%,26.78%,15.76%
63,Franklin India Smaller Companies Direct Fund Growth,Very High Risk,Equity,2,9.22%,26.77%,10.99%
64,PGIM India Flexi Cap Fund Direct Growth,Very High Risk,Equity,5,0.61%,26.69%,17.24%
65,ICICI Prudential Value Discovery Direct Growth,Very High Risk,Equity,4,18.77%,26.50%,15.69%
66,ICICI Prudential Thematic Advantage Fund (FOF)Direct Growth,Very High Risk,Other,,10.70%,26.36%,15.85%
67,HDFC Mid Cap Opportunities Direct Plan Growth,Very High Risk,Equity,3,16.79%,26.32%,13.87%
68,Bank of India Mid & Small Cap Equity & Debt Fund Direct Growth,Very High Risk,Hybrid,4,2.05%,26.22%,11.75%
69,Invesco India Infrastructure Fund Direct Growth,Very High Risk,Equity,5,8.88%,26.15%,14.72%
70,Kotak Infrastructure and Economic Reform Fund Direct Growth,Very High Risk,Equity,4,19.17%,26.06%,12.43%
71,Baroda BNP Paribas Midcap Direct Growth,Very High Risk,Equity,3,8.39%,25.98%,12.79%
72,Parag Parikh Tax Saver Fund Direct Growth,Moderately High Risk,Equity,5,11.72%,25.87%,NA%
73,Motilal Oswal Nifty Midcap 150 Index Fund Direct Growth,Moderately High Risk,Other,3,7.99%,25.84%,NA%
74,DSP World Mining Fund Direct Plan Growth,Very High Risk,Other,,22.39%,25.75%,17.42%
75,Nippon India Consumption Fund Direct Growth,Very High Risk,Equity,5,19.66%,25.73%,15.57%
76,SBI Healthcare Opportunities Fund Direct Plan Growth,Very High Risk,Equity,,3.48%,25.71%,13.82%
77,ICICI Prudential MNC Fund Direct Growth,High Risk,Equity,,9.08%,25.68%,NA%
78,Mahindra Manulife Multi Cap Badhat Yojana Direct Growth,Very High Risk,Equity,5,7.67%,25.66%,16.76%
79,Nippon India Pharma Fund Direct Growth,Very High Risk,Equity,,-2.24%,25.62%,17.61%
80,Bank of India Tax Advantage Direct Growth,Very High Risk,Equity,4,4.53%,25.61%,14.98%
81,Templeton India Value Fund Direct Plan Growth,Very High Risk,Equity,3,18.05%,25.60%,12.61%
82,HSBC Small Cap Equity Fund Direct Growth,Very High Risk,Equity,2,-8.76%,25.58%,7.62%
83,ICICI Prudential Pharma Healthcare And Diagnostics (P.H.D) Fund Direct Growth,Very High Risk,Equity,,-0.10%,25.55%,NA%
84,Mahindra Manulife Mid Cap Unnati Yojana Direct Growth,Very High Risk,Equity,3,8.19%,25.54%,NA%
85,ICICI Prudential Dividend Yield Equity Fund Direct Growth,Very High Risk,Equity,,16.58%,25.49%,12.13%
86,Tata Infrastructure Direct Plan Growth,Very High Risk,Equity,4,16.83%,25.47%,12.67%
87,Principal Global Opportunities Fund Direct Growth,Very High Risk,Other,1,27.05%,25.29%,17.49%
88,Templeton India Equity Income Direct Plan Growth,Very High Risk,Equity,,9.38%,25.23%,14.45%
89,IDFC Tax Advantage (ELSS) Direct Plan Growth,Very High Risk,Equity,4,11.02%,25.18%,14.34%
90,Invesco India Mid Cap Fund Direct Growth,Very High Risk,Equity,4,6.86%,25.14%,15.51%
91,Canara Robeco Infrastructure Direct Growth,Very High Risk,Equity,3,15.67%,25.05%,11.26%
92,HDFC Retirement Savings Fund Equity Plan Direct Growth,Very High Risk,Solution Oriented,5,12.29%,24.77%,15.30%
93,Tata India Pharma & HealthCare Fund Direct Growth,Very High Risk,Equity,,0.29%,24.62%,16.75%
94,Nippon India Power & Infra Fund Direct Growth,Very High Risk,Equity,3,15.71%,24.51%,10.09%
95,Quant Focused Fund Direct Growth,Very High Risk,Equity,5,11.24%,24.48%,15.19%
96,Parag Parikh Flexi Cap Fund Direct Growth,Very High Risk,Equity,5,-1.09%,24.45%,17.68%
97,HSBC Infrastructure Equity Fund Direct Growth,Very High Risk,Equity,1,9.17%,24.41%,3.43%
98,SBI Magnum COMMA Fund Direct Growth,Very High Risk,Equity,,1.53%,24.38%,12.82%
99,ICICI Prudential Focused Equity Fund Direct Growth,Very High Risk,Equity,4,11.28%,24.10%,14.93%
100,Franklin India Technology Fund Direct Growth,Very High Risk,Equity,,-13.41%,23.97%,19.94%
101,IDFC Infrastructure Direct Plan Growth,Very High Risk,Equity,2,7.14%,23.90%,7.64%
102,Sundaram Services Fund Direct Growth,Very High Risk,Equity,,7.03%,23.63%,NA%
103,Baroda Midcap Direct Fund Growth,Very High Risk,Equity,4,27.49%,23.56%,16.94%
104,Tata Midcap Growth Direct Plan Growth,Very High Risk,Equity,3,5.77%,23.54%,13.58%
105,ICICI Prudential Manufacturing Fund Direct Growth,Very High Risk,Equity,,14.46%,23.43%,NA%
106,ICICI Prudential Midcap Direct Plan Growth,Very High Risk,Equity,3,8.57%,23.33%,12.55%
107,Canara Robeco Equity Tax Saver Direct Growth,Very High Risk,Equity,5,6.02%,23.29%,17.36%
108,Tata Ethical Direct Plan Growth,Very High Risk,Equity,,4.40%,23.21%,14.09%
109,UTI Healthcare Fund Direct Growth,Very High Risk,Equity,,-4.57%,23.19%,13.56%
110,ICICI Prudential Large & Mid Cap Fund Direct Plan Growth,Very High Risk,Equity,3,14.78%,23.14%,14.23%
111,Taurus Discovery (Midcap) Fund Direct Growth,Very High Risk,Equity,3,9.69%,23.14%,13.06%
112,DSP Natural Resources and New Energy Fund Direct Plan Growth,Very High Risk,Equity,,12.27%,23.10%,11.31%
113,SBI Consumption Opportunities Fund Direct Growth,Very High Risk,Equity,3,17.24%,23.05%,14.44%
114,Nippon India Focused Equity Fund Direct Growth,Very High Risk,Equity,3,12.68%,22.97%,12.51%
115,Kotak Pioneer Fund Direct Growth,Very High Risk,Equity,,-4.28%,22.88%,NA%
116,Aditya Birla Sun Life Infrastructure Direct Fund Growth,Very High Risk,Equity,2,13.33%,22.85%,8.35%
117,Principal Emerging Bluechip Fund Direct Growth,Very High Risk,Equity,4,41.77%,22.81%,20.68%
118,DSP The Infrastructure Growth and Economic Reforms Regular Fund Direct Growth,Very High Risk,Equity,3,17.16%,22.81%,11.53%
119,SBI Large & Midcap Fund Direct Plan Growth,Very High Risk,Equity,5,13.67%,22.69%,14.75%
120,IIFL Focused Equity Fund Direct Growth,Very High Risk,Equity,5,5.74%,22.59%,17.65%
121,HDFC Focused 30 Fund Direct Plan Growth,Very High Risk,Equity,3,24.95%,22.57%,11.74%
122,Aditya Birla Sun Life Small Cap Fund Direct Growth,Very High Risk,Equity,1,-0.10%,22.37%,5.93%
123,Edelweiss Recently Listed IPO Fund Direct Growth,Very High Risk,Equity,,-16.28%,22.30%,NA%
124,JM Equity Hybrid Fund Direct Growth,Very High Risk,Hybrid,3,10.93%,22.22%,12.02%
125,Axis Midcap Direct Plan Growth,Very High Risk,Equity,5,0.44%,22.19%,17.40%
126,Canara Robeco Emerging Equities Fund Direct Growth,Very High Risk,Equity,4,4.64%,22.14%,13.91%
127,HDFC Large and Mid Cap Fund Direct Growth,Very High Risk,Equity,3,11.99%,22.07%,13.98%
128,Mirae Asset Emerging Bluechip Fund Direct Growth,Very High Risk,Equity,5,3.85%,21.93%,15.80%
129,Nippon India Value Fund Direct Growth,Very High Risk,Equity,3,10.60%,21.92%,13.32%
130,ICICI Prudential Retirement Fund Pure Equity Plan Direct Growth,Moderately High Risk,Solution Oriented,4,6.26%,21.90%,NA%
131,ICICI Prudential Equity & Debt Fund Direct Growth,Very High Risk,Hybrid,5,14.59%,21.87%,15.00%
132,Franklin India Flexi Cap Fund Direct Growth,Very High Risk,Equity,3,10.13%,21.84%,13.68%
133,PGIM India ELSS Tax Saver Fund Direct Growth,Very High Risk,Equity,4,10.89%,21.78%,14.66%
134,Axis Growth Opportunities Fund Direct Growth,Very High Risk,Equity,4,-3.14%,21.69%,NA%
135,SBI Infrastructure Fund Direct Growth,Very High Risk,Equity,4,13.65%,21.61%,12.37%
136,ICICI Prudential Multi Asset Fund Direct Growth,Very High Risk,Hybrid,4,18.40%,21.58%,14.48%
137,Edelweiss Large & Mid Cap Direct Plan Growth,Very High Risk,Equity,5,9.06%,21.57%,15.34%
138,Canara Robeco Consumer Trends Fund Direct Growth,Very High Risk,Equity,4,11.23%,21.57%,16.98%
139,Franklin Build India Direct Fund Growth,Very High Risk,Equity,3,14.61%,21.56%,12.95%
140,HDFC Flexi Cap Direct Plan Growth,Very High Risk,Equity,3,22.20%,21.55%,14.26%
141,Mirae Asset Tax Saver Fund Direct Growth,Very High Risk,Equity,5,5.74%,21.54%,16.48%
142,Nippon India Multi Cap Fund Direct Growth,Very High Risk,Equity,,18.20%,21.54%,13.58%
143,Aditya Birla Sun Life Dividend Yield Fund Direct Growth,Very High Risk,Equity,,12.10%,21.50%,10.56%
144,Kotak Multi Asset Allocator FoF Dynamic Direct Growth,Very High Risk,Other,,12.90%,21.41%,15.91%
145,Aditya Birla Sun Life Mid Cap Direct Fund Growth,Very High Risk,Equity,1,1.00%,21.30%,8.97%
146,Invesco India PSU Equity Fund Direct Growth,Very High Risk,Equity,,22.53%,21.26%,11.51%
147,HSBC Value Fund Direct Growth,Very High Risk,Equity,3,10.71%,21.24%,11.95%
148,Union Long Term Equity Fund Direct Growth,Very High Risk,Equity,4,6.99%,21.23%,14.38%
149,ICICI Prudential Exports and Services Fund Direct Growth,Very High Risk,Equity,,12.24%,21.09%,13.07%
150,Mahindra Manulife ELSS Kar Bachat Yojana Direct Growth,Very High Risk,Equity,3,9.17%,20.92%,12.31%
151,Sundaram Infrastructure Advantage Fund Direct Growth,Very High Risk,Equity,3,9.06%,20.91%,9.00%
152,Baroda BNP Paribas Multi Cap Fund Direct Growth,Very High Risk,Equity,4,4.52%,20.91%,12.61%
153,Invesco India Multicap Fund Direct Growth,Very High Risk,Equity,,3.87%,20.87%,11.82%
154,Aditya Birla Sun Life Pharma & Healthcare Fund Direct Growth,High Risk,Equity,,-4.11%,20.84%,NA%
155,Taurus Ethical Fund Direct Growth,Very High Risk,Equity,,5.06%,20.76%,14.21%
156,Invesco India Contra Fund Direct Growth,Very High Risk,Equity,4,9.47%,20.70%,14.38%
157,UTI Core Equity Fund Direct Growth,Very High Risk,Equity,2,8.10%,20.69%,11.45%
158,Mahindra Manulife Hybrid Equity Nivesh Yojana Direct Growth,Moderately High Risk,Hybrid,4,9.92%,20.66%,NA%
159,HSBC Value Fund Direct Growth,Very High Risk,Equity,2,7.02%,20.62%,11.02%
160,Union Flexi Cap Fund Direct Growth,Very High Risk,Equity,4,4.10%,20.60%,14.63%
161,Kotak Tax Saver Fund Direct Growth,Very High Risk,Equity,4,10.66%,20.54%,14.78%
162,Franklin India Focused Equity Fund Direct Growth,Very High Risk,Equity,3,12.69%,20.53%,13.70%
163,Motilal Oswal Large and Midcap Fund Direct Growth,Moderately High Risk,Equity,4,6.08%,20.49%,NA%
164,Kotak Equity Opportunities Fund Direct Growth,Very High Risk,Equity,4,12.36%,20.48%,14.47%
165,Sundaram Large and Mid Cap Fund Direct Growth,Very High Risk,Equity,3,4.16%,20.40%,12.62%
166,Franklin India Opportunities Direct Fund Growth,Very High Risk,Equity,,2.81%,20.39%,11.70%
167,SBI Long Term Equity Fund Direct Plan Growth,Very High Risk,Equity,3,11.10%,20.39%,12.17%
168,Nippon India Quant Fund Retail Direct Growth,Very High Risk,Equity,,12.10%,20.39%,13.40%
169,Navi Large & Midcap Fund Direct Growth,Very High Risk,Equity,3,8.76%,20.35%,13.65%
170,DSP Nifty 50 Equal Weight Index Fund Direct Growth,Very High Risk,Other,3,11.41%,20.31%,12.28%
171,Tata Large & Mid Cap Fund Direct Plan Growth,Very High Risk,Equity,4,15.13%,20.28%,14.98%
172,Sundaram Mid Cap Fund Direct Growth,Very High Risk,Equity,2,10.07%,20.21%,9.18%
173,Taurus Infrastructure Fund Direct Growth,Very High Risk,Equity,3,10.26%,20.20%,11.12%
174,Mirae Asset Focused Fund Direct Growth,Very High Risk,Equity,4,-1.21%,20.18%,NA%
175,UTI Transportation and Logistics Fund Direct Growth,Very High Risk,Equity,,20.08%,20.14%,6.52%
176,IDBI Midcap Fund Direct Growth,Very High Risk,Equity,1,2.08%,20.13%,9.48%
177,Canara Robeco Flexi Cap Fund Direct Growth,Very High Risk,Equity,4,4.18%,20.11%,15.48%
178,IDFC Core Equity Fund Direct Growth,Very High Risk,Equity,3,12.82%,20.09%,12.59%
179,Union Focused Fund Direct Growth,Moderately High Risk,Equity,4,4.76%,20.01%,NA%
180,IDBI Dividend Yield Fund Direct Growth,Very High Risk,Equity,,5.06%,20.01%,NA%
181,IDBI Flexi Cap Fund Direct Growth,Very High Risk,Equity,3,6.33%,19.99%,13.63%
182,Kotak India EQ Contra Fund Direct Growth,Very High Risk,Equity,4,12.40%,19.97%,15.70%
183,Sundaram Focused Fund Direct Growth,Very High Risk,Equity,4,4.19%,19.94%,14.67%
184,SBI Equity Minimum Variance Fund Direct Growth,Very High Risk,Equity,,10.79%,19.91%,NA%
185,HSBC Infrastructure Fund Direct Growth,Very High Risk,Equity,3,9.95%,19.88%,8.52%
186,UTI Value Opportunities Fund Direct Growth,Very High Risk,Equity,4,8.61%,19.88%,14.29%
187,DSP Tax Saver Direct Plan Growth,Very High Risk,Equity,4,8.52%,19.86%,14.27%
188,Sundaram Multi Cap Fund Direct Growth,Very High Risk,Equity,,4.88%,19.73%,11.24%
189,IDBI Healthcare Fund Direct Growth,High Risk,Equity,,-5.15%,19.72%,NA%
190,Bank of India Large & Mid Cap Equity Fund Direct Growth,Very High Risk,Equity,2,7.13%,19.64%,11.05%
191,Sundaram Dividend Yield Fund Direct Growth,Very High Risk,Equity,,7.04%,19.56%,12.52%
192,Mirae Asset Great Consumer Fund Direct Growth,Very High Risk,Equity,3,11.20%,19.54%,15.28%
193,Edelweiss Flexi Cap Fund Direct Growth,Very High Risk,Equity,3,8.61%,19.53%,13.45%
194,Baroda BNP Paribas India Consumption Fund Direct Growth,Very High Risk,Equity,4,7.65%,19.50%,NA%
195,BNP Paribas Multi Cap Fund Direct Growth,Very High Risk,Equity,,20.46%,19.42%,15.26%
196,JM Flexicap Fund Direct Plan Growth,Very High Risk,Equity,3,12.08%,19.41%,14.49%
197,IDBI India Top 100 Equity Fund Direct Growth,Very High Risk,Equity,4,8.74%,19.32%,13.80%
198,HSBC Infrastructure Fund Direct Growth,Very High Risk,Equity,3,5.31%,19.24%,8.00%
199,Franklin India Taxshield Direct Growth,Very High Risk,Equity,3,10.05%,19.18%,12.77%
200,LIC MF Infrastructure Fund Direct Growth,Very High Risk,Equity,3,12.56%,19.14%,11.89%
201,Aditya Birla Sun Life India GenNext Direct Fund Growth,Very High Risk,Equity,3,8.58%,19.13%,15.04%
202,JM Value Fund Direct Plan Growth,Very High Risk,Equity,2,9.15%,19.11%,12.22%
203,Aditya Birla Sun Life Pure Value Direct Fund Growth,Very High Risk,Equity,1,8.48%,19.06%,4.88%
204,JM Tax Gain Direct Plan Growth,Very High Risk,Equity,3,4.87%,19.06%,14.02%
205,Franklin India Prima Direct Fund Growth,Very High Risk,Equity,2,5.92%,19.04%,11.33%
206,HDFC Capital Builder Value Fund Direct Plan Growth,Very High Risk,Equity,2,9.98%,19.01%,11.26%
207,Canara Robeco Bluechip Equity Fund Direct Growth,Very High Risk,Equity,5,5.66%,18.98%,16.15%
208,Kotak Equity Hybrid Fund Direct Growth,Very High Risk,Hybrid,4,9.03%,18.92%,13.52%
209,HSBC Midcap Fund Direct Growth,Very High Risk,Equity,2,5.44%,18.91%,9.38%
210,UTI Long Term Equity Fund Direct Growth,Very High Risk,Equity,3,1.65%,18.83%,12.67%
211,Kotak Focused Equity Fund Direct Growth,Very High Risk,Equity,3,6.76%,18.79%,NA%
212,ICICI Prudential Multicap Fund Direct Plan Growth,Very High Risk,Equity,,10.48%,18.77%,13.43%
213,Tata India Consumer Fund Direct Growth,Very High Risk,Equity,2,8.16%,18.74%,12.24%
214,SBI Magnum Global Direct Plan Growth,Very High Risk,Equity,,1.95%,18.71%,11.30%
215,HSBC Business Cycles Fund Direct Growth,Very High Risk,Equity,,10.74%,18.71%,8.93%
216,Tata India Tax Savings Fund Direct Growth,Very High Risk,Equity,3,12.36%,18.67%,13.21%
217,UTI Dividend Yield Fund Direct Growth,Very High Risk,Equity,,1.06%,18.67%,12.55%
218,HDFC Balanced Advantage Fund Direct Plan Growth,Very High Risk,Hybrid,3,20.09%,18.61%,12.41%
219,Quantum India ESG Equity Fund Direct Growth,High Risk,Equity,,1.62%,18.59%,NA%
220,HDFC Taxsaver Direct Plan Growth,Very High Risk,Equity,2,15.10%,18.56%,10.27%
221,UTI Flexi Cap Fund Direct Growth,Very High Risk,Equity,4,-8.25%,18.55%,14.85%
222,HSBC Business Cycles Fund Direct Growth,Very High Risk,Equity,,7.47%,18.43%,8.52%
223,DSP Equity Opportunities Direct Plan Growth,Very High Risk,Equity,3,8.09%,18.43%,12.30%
224,ICICI Prudential Bluechip Fund Direct Growth,Very High Risk,Equity,5,11.21%,18.43%,13.64%
225,ICICI Prudential Long Term Equity Fund (Tax Saving) Direct Plan Growth,Very High Risk,Equity,4,6.97%,18.39%,13.79%
226,Motilal Oswal Nifty 500 Index Fund Direct Growth,Moderately High Risk,Other,3,7.45%,18.28%,NA%
227,HSBC Midcap Fund Direct Growth,Very High Risk,Equity,2,1.58%,18.22%,8.75%
228,LIC MF Large & Mid Cap Fund Direct Growth,Very High Risk,Equity,3,4.83%,18.19%,13.25%
229,Nippon India Large Cap Fund Direct Growth,Very High Risk,Equity,3,15.24%,18.17%,13.12%
230,Edelweiss Aggressive Hybrid Fund Direct Growth,Very High Risk,Hybrid,4,9.99%,18.08%,13.75%
231,Sundaram Select Focus Fund Direct Growth,Very High Risk,Equity,5,25.71%,18.04%,18.50%
232,HSBC Large and Mid Cap Fund Direct Growth,Moderately High Risk,Equity,2,4.03%,17.94%,NA%
233,DSP Midcap Direct Plan Growth,Very High Risk,Equity,2,-0.19%,17.91%,11.06%
234,Nippon India Vision Direct Growth,Very High Risk,Equity,1,7.21%,17.91%,8.51%
235,ICICI Prudential BHARAT 22 FOF Direct Growth,Very High Risk,Other,1,28.72%,17.88%,NA%
236,UTI Mastershare Direct Growth,Very High Risk,Equity,4,3.57%,17.86%,13.66%
237,UTI Hybrid Equity Fund Direct Fund Growth,Very High Risk,Hybrid,3,8.53%,17.86%,10.49%
238,UTI Infrastructure Fund Direct Growth,Very High Risk,Equity,2,12.82%,17.85%,9.49%
239,IDBI Long Term Value Fund Direct Growth,Very High Risk,Equity,2,5.19%,17.84%,NA%
240,Kotak Bluechip Fund Direct Growth,Very High Risk,Equity,5,6.46%,17.83%,14.03%
241,Edelweiss Large Cap Fund Direct Growth,Very High Risk,Equity,4,8.66%,17.77%,14.27%
242,Edelweiss Long Term Equity Fund (Tax Savings) Direct Growth,Very High Risk,Equity,3,7.85%,17.76%,11.46%
243,Franklin India Equity Advantage Fund Direct Growth,Very High Risk,Equity,2,1.86%,17.68%,10.74%
244,IDBI Focused 30 Equity Fund Direct Growth,Very High Risk,Equity,2,4.69%,17.63%,11.44%
245,Tata Equity PE Fund Direct Growth,Very High Risk,Equity,3,10.41%,17.58%,11.28%
246,DSP Flexi Cap Fund Direct Plan Growth,Very High Risk,Equity,3,0.15%,17.56%,13.10%
247,Baroda Equity Linked Saving Scheme 96 Direct Growth,Very High Risk,Equity,3,18.49%,17.55%,12.53%
248,SBI Bluechip Direct Plan Growth,Very High Risk,Equity,3,8.25%,17.51%,12.70%
249,HDFC Retirement Savings Fund Hybrid Equity Plan Direct Growth,Very High Risk,Solution Oriented,4,7.07%,17.48%,12.79%
250,Indiabulls Value Fund Direct Growth,Very High Risk,Equity,2,6.72%,17.45%,7.57%
251,Aditya Birla Sun Life Flexi Cap Fund Direct Growth,Very High Risk,Equity,3,5.29%,17.42%,12.26%
252,ICICI Prudential Bharat Consumption Fund Direct Growth,High Risk,Equity,3,14.12%,17.37%,NA%
253,HDFC Hybrid Equity Fund Direct Plan Growth,Very High Risk,Hybrid,3,11.50%,17.28%,12.01%
254,Mahindra Manulife Large Cap Pragati Yojana Direct Growth,Moderately High Risk,Equity,4,7.17%,17.27%,NA%
255,SBI PSU Direct Plan Growth,Very High Risk,Equity,,31.20%,17.20%,6.15%
256,HSBC Tax Saver Equity Fund Direct Growth,Very High Risk,Equity,2,6.92%,17.20%,10.44%
257,Navi Flexi Cap Fund Direct Growth,Very High Risk,Equity,3,8.62%,17.19%,NA%
258,HSBC Flexi Cap Fund Direct Growth,Very High Risk,Equity,2,1.79%,17.16%,10.06%
259,HDFC Infrastructure Direct Plan Growth,Very High Risk,Equity,1,22.37%,17.16%,3.26%
260,Taurus Nifty 50 Index Fund Direct Growth,Very High Risk,Other,,8.60%,17.13%,14.27%
261,Sundaram Equity Hybrid Fund Direct Growth,High Risk,Hybrid,4,30.11%,17.11%,15.70%
262,Baroda BNP Paribas Balanced Advantage Fund Direct Growth,Very High Risk,Hybrid,4,7.09%,17.10%,NA%
263,IDFC Nifty 50 Index Direct Plan Growth,Very High Risk,Other,4,8.90%,17.08%,14.32%
264,SBI Focused Equity Fund Direct Plan Growth,Very High Risk,Equity,4,-5.70%,17.04%,13.61%
265,Sundaram Diversified Equity Fund Direct Growth,Very High Risk,Equity,2,31.78%,17.03%,14.26%
266,DSP Quant Fund Direct Growth,High Risk,Equity,,-1.45%,17.03%,NA%
267,Aditya Birla Sun Life Frontline Equity Direct Fund Growth,Very High Risk,Equity,3,7.92%,17.02%,12.12%
268,Baroda BNP Paribas Large Cap Fund Direct Growth,Very High Risk,Equity,5,9.16%,17.02%,13.92%
269,Baroda BNP Paribas Focused Fund Direct Growth,Very High Risk,Equity,3,7.10%,17.01%,10.28%
270,Invesco India Largecap Fund Direct Growth,Very High Risk,Equity,4,2.32%,17.00%,13.24%
271,Sundaram Nifty 100 Equal Weight Fund Direct Growth,Very High Risk,Other,2,5.87%,16.97%,10.36%
272,SBI Flexicap Fund Direct Growth,Very High Risk,Equity,3,5.31%,16.93%,12.07%
273,ICICI Prudential FMCG Direct Growth,Very High Risk,Equity,,21.63%,16.89%,13.75%
274,Motilal Oswal Nasdaq 100 FOF Direct Growth,Very High Risk,Other,,-21.10%,16.89%,NA%
275,Canara Robeco Equity Hybrid Fund Direct Growth,Very High Risk,Hybrid,4,6.36%,16.88%,13.52%
276,Baroda BNP Paribas Aggressive Hybrid Fund Direct Growth,Very High Risk,Hybrid,5,8.72%,16.84%,14.30%
277,Aditya Birla Sun Life Manufacturing Equity Fund Direct Growth,Very High Risk,Equity,,4.04%,16.83%,7.95%
278,HDFC Multi Asset Fund Direct Growth,Very High Risk,Hybrid,4,6.80%,16.77%,11.42%
279,UTI Nifty 50 Index Fund Direct Growth,Very High Risk,Other,3,8.61%,16.76%,14.15%
280,ICICI Prudential Nifty 50 Index Direct Plan Growth,Very High Risk,Other,3,8.61%,16.76%,14.02%
281,Invesco India Tax Plan Direct Growth,Very High Risk,Equity,3,-1.30%,16.76%,12.84%
